100,28,Virtualization Security,"I am tasked with ensuring the security and integrity of my organization's virtualized environments, including developing and implementing secure virtualization practices, configuring the security settings, and ensuring ongoing monitoring and reporting. However, I am facing challenges in selecting the most suitable virtualization security methodologies, configuring the security parameters, and ensuring compliance with regulatory requirements. I would greatly appreciate guidance on how to develop a comprehensive virtualization security plan, including recommendations on secure virtualization practices, security settings, and compliance procedures.",08-OCT-24,08-OCT-24,1,28
102,30,Web Application Security,"I am responsible for ensuring the security and integrity of my organization's web applications, including developing and implementing secure coding practices, conducting regular code reviews, and performing security testing. However, I am facing challenges in selecting the most suitable web application security methodologies, configuring the security settings, and ensuring ongoing monitoring and reporting. I require expert assistance in designing a comprehensive web application security plan, including recommendations on secure coding practices, code review procedures, and security testing methodologies.",10-OCT-24,10-OCT-24,1,30
20,8,DNS Resolution Issue,"I am experiencing difficulties with DNS resolution, resulting in failed website loads and inability to access certain online services. I have tried flushing my DNS cache and restarting my router, but the issue remains unresolved. I suspect that there may be a problem with my DNS settings or the DNS servers themselves. Could someone please investigate this matter further and provide guidance on how to resolve the issue?",10-SEP-24,10-SEP-24,1,8
66,34,Compliance and Regulatory Requirements,"I am seeking expert guidance on ensuring compliance with various regulatory requirements, including GDPR, HIPAA, and PCI-DSS, for my organization's IT infrastructure and data processing activities. Specifically, I am struggling to select the most effective compliance frameworks, configure the compliance settings, and ensure ongoing monitoring and reporting. I would greatly appreciate recommendations on compliance best practices, risk assessment methodologies, and audit preparation procedures.",04-OCT-24,04-OCT-24,2,34
30,24,Router Configuration Issue,"I recently attempted to configure my router to prioritize certain devices on my network, but now I am experiencing issues with my internet connection. Specifically, I am unable to access certain websites, and my streaming services are buffering excessively. I suspect that there may be a conflict between my router settings and the devices on my network. Could someone please guide me through the process of resetting my router to its default settings and reconfiguring it to meet my needs?",09-SEP-24,09-SEP-24,1,8
38,6,Multi-Network Environment Issue,"I operate a multi-network environment, consisting of several separate networks, each with its own unique configuration and requirements. Unfortunately, I am experiencing difficulties in managing and maintaining these networks, particularly when it comes to ensuring seamless communication and data exchange between them. I am seeking expert advice on how to design and implement a unified network architecture that integrates all my networks, providing a cohesive and efficient infrastructure for my organization. Furthermore, I would appreciate guidance on how to develop a comprehensive network management strategy, including monitoring, troubleshooting, and security measures.",06-SEP-24,06-SEP-24,1,6
108,36,Artificial Intelligence and Machine Learning Security,"I am responsible for ensuring the security and integrity of my organization's artificial intelligence and machine learning systems, including developing and implementing secure AI/ML practices, configuring the security settings, and ensuring ongoing monitoring and reporting. However, I am facing challenges in selecting the most suitable AI/ML security methodologies, configuring the security parameters, and ensuring compliance with regulatory requirements. I require expert assistance in designing a comprehensive AI/ML security plan, including recommendations on secure AI/ML practices, security settings, and compliance procedures.",16-OCT-24,16-OCT-24,1,36
78,6,Cybersecurity Risk Assessment and Mitigation,"I am responsible for conducting a comprehensive cybersecurity risk assessment for my organization, including identifying potential threats, assessing vulnerabilities, and developing effective mitigation strategies. However, I am facing challenges in selecting the most suitable risk assessment methodologies, configuring the assessment parameters, and interpreting the results to inform mitigation decisions. I require expert assistance in designing a comprehensive cybersecurity risk assessment plan, including recommendations on risk assessment methodologies, threat modeling, and mitigation strategies.",16-SEP-24,16-SEP-24,2,6
88,16,Network Access Control and Authentication,"I am responsible for ensuring the security and integrity of my organization's network access control and authentication systems, including developing and implementing access control policies, configuring authentication protocols, and ensuring ongoing monitoring and reporting. However, I am facing challenges in selecting the most suitable access control methodologies, configuring the authentication settings, and ensuring compliance with regulatory requirements. I require expert assistance in designing a comprehensive network access control plan, including recommendations on access control methodologies, authentication protocols, and compliance procedures.",26-SEP-24,26-SEP-24,1,16
98,26,Unified Communications Security,"I am responsible for ensuring the security and integrity of my organization's unified communications systems, including developing and implementing secure communication protocols, configuring the security settings, and ensuring ongoing monitoring and reporting. However, I am facing challenges in selecting the most suitable unified communications security methodologies, configuring the security parameters, and ensuring compliance with regulatory requirements. I require expert assistance in designing a comprehensive unified communications security plan, including recommendations on secure communication protocols, security settings, and compliance procedures.",06-OCT-24,06-OCT-24,1,26
1053,28,"Simple VM + VCN","Create a diagram where a VM instance is deployed in a public subnet inside a VCN.",12-JUN-2025,12-JUN-2025,1,28
1054,28,"Load Balancer + 2 VMs","Show two VM instances behind a Load Balancer in a private subnet.",12-JUN-2025,12-JUN-2025,1,28
1055,28,"Autonomous DB with Functions","Show a Function connected to an Autonomous DB for event-driven data processing.",12-JUN-2025,12-JUN-2025,1,28